{
  "meeting_id": "MTG-2026-042",
  "summary": "Sprint 12 Planning - Discussed API integration timeline and resource allocation for payment module",
  "decisions": [
    {
      "decision": "Approved 2-week timeline for API integration phase",
      "owner": "tech_lead"
    },
    {
      "decision": "Added security review gate before production deployment",
      "owner": "security_lead"
    }
  ],
  "action_items": [
    {
      "action": "Create technical design document for payment API integration",
      "owner": "senior_developer",
      "due_date": "2026-06-21T17:00:00Z",
      "target_system": "jira"
    },
    {
      "action": "Schedule security review session with InfoSec team",
      "owner": "tech_lead",
      "due_date": "2026-06-22T10:00:00Z",
      "target_system": "jira"
    }
  ],
  "risks": [
    "Third-party API rate limits may require caching strategy",
    "PCI DSS compliance requirements not fully defined"
  ],
  "open_questions": [
    "What is the maximum acceptable API response time?",
    "Should we implement retry logic for failed payments?"
  ],
  "publish_recommendation": "confluence",
  "confidence": 90,
  "proposed_external_mutations": [
    {
      "action": "Create Jira tickets for action items",
      "target_system": "jira",
      "approval_required": false
    }
  ]
}
